{
  "$schema": "https://json-schema.org/draft/2020-12/schema",
  "$id": "https://dc-farmer.example/schema/committee-role.json",
  "title": "CommitteeRole",
  "type": "object",
  "required": ["id", "title", "order"],
  "properties": {
    "id": { "type": "string", "pattern": "^[a-z0-9-]+$" },
    "title": { "type": "string", "minLength": 2, "maxLength": 80 },
    "description": { "type": "string", "maxLength": 160 },
    "order": { "type": "integer", "minimum": 1 }
  },
  "additionalProperties": false
}
